{
  "$schema": "./capabilities.schema.json",
  "schema_version": 3,
  "reviewed": "2026-09-12",
  "principle": "Same intent, native harness surfaces. Unsupported capabilities are named, not simulated.",
  "agent_frontmatter": {
    "tool_vocabulary": [
      "Task",
      "Read",
      "Write",
      "Edit",
      "MultiEdit",
      "Grep",
      "Glob",
      "Bash",
      "WebFetch",
      "WebSearch",
      "AskUserQuestion"
    ],
    "tool_allowlist_enforced": {
      "claude": true,
      "codex": false,
      "copilot": false,
      "opencode": false
    }
  },
  "harnesses": {
    "claude": {
      "executable": "claude",
      "home_env": "CLAUDE_HOME",
      "capabilities": {
        "commands": {
          "support": "native",
          "surface": "commands/<namespace>/<command>.md",
          "verifier": "doctor:symlinks",
          "limitations": []
        },
        "skills": {
          "support": "native",
          "surface": "skills/<namespace>-<skill>",
          "verifier": "doctor:symlinks",
          "limitations": []
        },
        "agents": {
          "support": "native",
          "surface": "agents/<namespace>/<agent>.md",
          "verifier": "doctor:symlinks",
          "limitations": []
        },
        "hooks": {
          "support": "native",
          "surface": "settings.json",
          "verifier": "doctor:hook-paths",
          "limitations": [
            "Claude Code replaces any hook output string over 10,000 characters with a file path and a 2,000-character preview it never asks the model to read (since 2.1.89; per string, not raisable). Memory and the operational layer therefore ride separate SessionStart entries (session-start.sh, operational-context.sh), and each admits context blocks in order within 9,500 bytes, naming any omitted block first (verifier: tests/test-hooks.sh)"
          ]
        },
        "subagents": {
          "support": "native",
          "surface": "Task with agents/<namespace>/<agent>.md definitions",
          "verifier": "tests:test-install + test-workflow-contracts",
          "limitations": []
        },
        "verify-pass-complete": {
          "support": "native",
          "surface": "Stop -> verify-pass-complete.sh -> one JSON block decision; stop_hook_active skips the retry",
          "verifier": "doctor:hook-paths + tests:test-hooks/test-install/test-doctor",
          "limitations": [
            "Advisory completion nudge only; the handler fails open"
          ]
        },
        "control-status": {
          "support": "partial",
          "surface": "SessionStart -> session-start; UserPromptSubmit -> prompt-submitted; PostToolUse -> tool-completed; PostToolUseFailure -> tool-completed; Stop -> turn-stopped; SessionEnd -> session-ended",
          "verifier": "control doctor:hooks + tests:test-session-hub-hooks",
          "limitations": [
            "permission-requested is not claimed; Notification is multi-purpose and its payload is unverified"
          ]
        },
        "persona": {
          "support": "native",
          "surface": "--append-system-prompt-file",
          "verifier": "launch-wrapper",
          "limitations": [
            "SessionStart supplies additional runtime context",
            "ASHA_PERSONA=0 (set by Control for managed workers) skips the identity render; the operational layer still loads where it is file-based, and plain launches are unchanged (verifier: tests/test-worker-persona.sh)",
            "ASHA_SESSION_PROFILE=chair|room|worker is the launcher's explicit statement and outranks ASHA_PERSONA; an absent or unrecognized value is legacy behaviour (verifier: tests/test-session-profiles.sh)"
          ]
        },
        "workspace": {
          "support": "native",
          "surface": "shared Memory v2 publication/recovery tools, bounded SessionStart workspace context, and workspace management CLI",
          "verifier": "tests:test-hooks/test-install/test-opencode + python test_memory_v2/test_recovery_state/test_workspace_*",
          "limitations": []
        },
        "session-profile": {
          "support": "native",
          "surface": "bin/asha reads ASHA_SESSION_PROFILE: chair = identity + operational SessionStart context + chair brief; room = the same without the chair brief; worker = plain `claude` with the user's own settings.json permissions, repository instructions and installed skills, and every Asha context hook silent",
          "verifier": "tests:test-session-profiles + tests:test-session-hub-hooks",
          "limitations": [
            "Installed Asha skills, commands and agents stay discoverable in a worker; only the automatic context injection is removed",
            "Hub session activity is observed through control-event.sh on SessionStart, UserPromptSubmit, PreToolUse, PostToolUse, Stop and SessionEnd; permission-requested is not claimed for Claude",
            "SessionStart forwards its payload source: only clear (/clear), or a start after the bound conversation's SessionEnd, rebinds a hub session's native conversation, so a nested claude -p (startup) is refused",
            "The observation bridge is bounded and fail-open, so a missing observation leaves activity unknown rather than gating the session"
          ]
        },
        "session-close": {
          "support": "native",
          "surface": "session close -> best-effort: queued hub message; a working session gets the request once as its Stop-hook block decision; an idle or unobserved pane gets one typed pointer line; bounded wait, then termination labelled saved or unsaved",
          "verifier": "python test_control_session_closure/test_session_publication_rows/test_session_emitted_at; tests:test-session-hub-hooks",
          "limitations": [
            "Best-effort: the close ends at the first publication after the request, at process exit, or at the deadline (default 60 s); an unanswered request closes unsaved",
            "The pointer line is typed by the close's own waiter after Room ownership is verified, at most once per request; a session at a native question or permission prompt is not typed into",
            "Publication runs through memory_v2 with a compare-and-swap; no Git seam; a kill mid-publication leaves the recovery journal",
            "The Stop decision is printed before delivery is recorded; a Stop that follows a delivered block carries stop_hook_active and emits nothing",
            "An absent, malformed or over-bound Stop payload is treated as stop_hook_active (no block); delivery is confirmed only for its exact request and generation",
            "Delivery through the Stop seam requires jq in the worker's PATH; the queued message and pointer line remain"
          ]
        },
        "session-guidance": {
          "support": "partial",
          "surface": "Automatic active compatible worker guidance on launch/send/resume; --learning selects explicitly and --no-learning supplies none",
          "verifier": "python test_experience_automatic_guidance/test_experience_guidance_regressions/test_experience_retired",
          "limitations": [
            "At most three rules and 3 KiB; project scope, harness scope, distinct source-session count then ID; Rooms unchanged",
            "Supply is not proof of use; unknown native version and outcomes remain unknown",
            "Native delivery probes remain outstanding"
          ]
        },
        "project-memory": {
          "support": "partial",
          "surface": "project-memory skill; hub worker/Room assignments; explicit save and session handoff publication rows; ungated finished report",
          "verifier": "python test_session_publication_rows + test_control_session_closure; tests:test-install/test-session-hub-hooks",
          "limitations": [
            "Controller/scripted fixtures are not native finish-save-idle delivery proof; no paid native probe performed",
            "Every successful save records a publication row (explicit save, close, handoff or no-durable-update attestation); saved is read from those rows only",
            "No Git publication, transcript extraction, chair context, or native permission bypass",
            "Structured close is the next structured turn, then a stop request; native permissions may block the handoff CLI"
          ]
        }
      }
    },
    "codex": {
      "executable": "codex",
      "home_env": "CODEX_HOME",
      "capabilities": {
        "commands": {
          "support": "rendered",
          "surface": "skills/<command>/SKILL.md",
          "verifier": "doctor:content",
          "limitations": [
            "No documented user-defined slash-command file surface"
          ]
        },
        "skills": {
          "support": "native",
          "surface": "skills/<skill>/SKILL.md",
          "verifier": "doctor:symlinks",
          "limitations": [
            "Public documentation names $HOME/.agents/skills as the canonical authoring location; this compatibility path is locally verified"
          ]
        },
        "agents": {
          "support": "rendered",
          "surface": "agents/<namespace>-<agent>.toml",
          "verifier": "doctor:content",
          "limitations": [
            "Claude-only tool names are mapped by instruction"
          ]
        },
        "hooks": {
          "support": "partial",
          "surface": "hooks.json",
          "verifier": "doctor:toml-hooks",
          "limitations": [
            "hooks.json is ledger-owned; native config.toml keeps only the hooks feature flag and hash-bound hook trust, and install reads it but never writes it",
            "Some unified_exec shell calls are not intercepted",
            "Non-shell non-MCP tools are not universally intercepted",
            "Hooks are not a complete enforcement boundary"
          ]
        },
        "subagents": {
          "support": "native",